<?xml version="1.0" encoding="UTF-8"?>
<prato xmlns="http://cartaodevisitas.org" xmlns:xsi="http://www.w3.org/2001/XMLSchema-instance" xsi:schemaLocation="http://cartaodevisitas.org prato.xsd">
    <nome>Feijoada</nome>
    <refeição>almoço</refeição>
    <ingredientes>
        <ingrediente>Feijão preto</ingrediente>
        <ingrediente>Carne seca</ingrediente>
        <ingrediente>Linguiça</ingrediente>
        <ingrediente>Costelinha de porco</ingrediente>
    </ingredientes>
    <preço>25.99</preço>

</prato>